,title,imageUrl,description,dateCreated,duration,reviewBody,movieUrl,starRating,actors,directors
429,Million Dollar Baby (2004) - IMDb,https://m.media-amazon.com/images/M/MV5BMTkxNzA1NDQxOV5BMl5BanBnXkFtZTcwNTkyMTIzMw@@._V1_.jpg,"Frankie, an ill-tempered old coach, reluctantly agrees to train aspiring boxer Maggie. Impressed with her determination and talent, he helps her become the best and the two soon form a close bond.",2011-04-15,2H12M,"I didn&apos;t view this film until today because I simply wasn&apos;t interested in women in boxing; however, I wish I&apos;d seen it years ago! Hillary Swank can never make another film and this one would be her crowning glory. It takes you on a wild ride of emotions from the beginning and Clint Eastwood&apos;s curmudgeon self is part of it all. Naturally, the &quot;voice of God&quot; in Morgan Freeman is there to explain it all and give some meaning to what each of the characters fell. By now, everyone knows the ending but I still won&apos;t spoil it for late-comers to the film like myself. I do believe much has been made about it and it&apos;s unnecessary. Yes, you will be torn about what is morally right but you can certainly understand how Eastwood&apos;s and Swank&apos;s characters feel! Please see this film. You will understand pugilism more than ever before and you just might see some of your own self in the film! It is well worth the time!",https://www.imdb.com/title/tt0405159/,8.1,"['Hilary Swank', 'Clint Eastwood', 'Morgan Freeman']",['Clint Eastwood']
430,Spider-Man: No Way Home (2021) - IMDb,https://m.media-amazon.com/images/M/MV5BMmFiZGZjMmEtMTA0Ni00MzA2LTljMTYtZGI2MGJmZWYzZTQ2XkEyXkFqcGc@._V1_.jpg,"With Spider-Man&apos;s identity now revealed, Peter asks Doctor Strange for help. When a spell goes wrong, dangerous foes from other worlds start to appear.",2021-12-16,2H28M,"If you thought the Marvel Universe had reached it&apos;s climax with Avengers Endgame, then think again, this was superb, and far more entertaining than any other Spiderman movie. Very cleverly done, mixing laughs and tears. If this is the way phase 4 is going to go then bring it on. This is the reason you go to the cinema, wonderful entertainment.",https://www.imdb.com/title/tt10872600/,8.2,"['Tom Holland', 'Zendaya', 'Benedict Cumberbatch']",['Jon Watts']
431,My Neighbor Totoro (1988) - IMDb,https://m.media-amazon.com/images/M/MV5BYWM3MDE3YjEtMzIzZC00ODE5LTgxNTItNmUyMTBkM2M2NmNiXkEyXkFqcGc@._V1_.jpg,"When two girls move to the country to be near their ailing mother, they have adventures with the wondrous forest spirits who live nearby.",2005-01-01,1H26M,"There is no compulsory villain in this wonderfully animated film, no moral lessons, no standard blue print story, and the characters will definitely not break out in a song. Thank God! It&apos;s simply a great film for all ages. Don&apos;t mind if the soundtrack isn&apos;t dubbed to your native language, my kids (4 and 6 years old) could easily follow the story with just a few helpers. Japanese is a wonderful language. The film has great direction, beautiful backgrounds and a mystical, pleasant aura throughout. There&apos;s nothing like this, I promise you. It&apos;s idyllic, for the most part, but still with an exciting story that unfolds into something very unexpected.",https://www.imdb.com/title/tt0096283/,8.1,"['Hitoshi Takagi', 'Noriko Hidaka', 'Chika Sakamoto']",['Hayao Miyazaki']
432,Mad Max: Fury Road (2015) - IMDb,https://m.media-amazon.com/images/M/MV5BZDRkODJhOTgtOTc1OC00NTgzLTk4NjItNDgxZDY4YjlmNDY2XkEyXkFqcGc@._V1_.jpg,"In a post-apocalyptic wasteland, a woman rebels against a tyrannical ruler in search for her homeland with the aid of a group of female prisoners, a psychotic worshipper and a drifter named Max.",2015-05-25,2H,"The rationale behind the success of &apos;Fury Road&apos; predominantly lies with director George Miller whose commitment and love for the film series that he&apos;s been developing since its first outing in 1979 is evident throughout, and it&apos;s pretty obvious that he knows how to craft a damn fine action sequence. Without this passion, the film would have likely stooped as there&apos;s not much else in the way of a plot or character development, even though Theron tries her hardest to give us an enthralling new action heroine to be revered. Aside from the aforementioned writing setbacks, &apos;Fury Road&apos; is a powerhouse in the technical categories. With stunning contradictory cinematography from John Seale giving us a post-apocalyptic world of lavish colour rather than your typical muted tones, a heart-pounding score from Junkie XL and exquisite production design work that rightfully earnt the film an Oscar (one of six) for its spectacular vehicle design.",https://www.imdb.com/title/tt1392190/,8.1,"['Tom Hardy', 'Charlize Theron', 'Nicholas Hoult']",['George Miller']
433,Ben-Hur (1959) - IMDb,https://m.media-amazon.com/images/M/MV5BNjg2M2E1YzYtOThmMC00NjAyLWI5MzgtMDEwOGFiODdlOGUzXkEyXkFqcGc@._V1_.jpg,"A Jewish prince is betrayed and sent into slavery by a Roman friend in 1st-century Jerusalem, but it&apos;s not long before he regains his freedom and comes back for revenge.",2012-06-22,3H32M,"What&apos;s not to love about BEN-HUR? It&apos;s a film that tells an epic story in an epic way, filling every shot with artistry and colour until the screen overflows with splendour. Despite a lengthy running time, the pacing never flags. The episodic structure of the storyline works in the film&apos;s favour, ably chronicling the adventures of the titular character as he undergoes a thrilling journey to hell and back.

It has Charlton Heston playing his most famous role and being incredibly manly and heroic in it. It has a cast of seasoned performers in support, not least Jack Hawkins as the sympathetic Roman. It has Stephen Boyd as a truly nasty piece of work villain. It has the most spectacular and complex action sequence ever put on film in the shape of the chariot race, which is just as thrilling and breathtaking as it was when it was first released in cinemas back in the day.

And, finally, it&apos;s a film engages the senses and the emotions. It never forgets, amid all the glory and the epic wonder of the scenery and action, that this is a human story about real people struggling with their lives. There&apos;s a message there for any viewer, Christian or otherwise, and that&apos;s the reason why BEN-HUR hasn&apos;t dated a day since it was first released. It&apos;s a true classic for a reason.",https://www.imdb.com/title/tt0052618/,8.1,"['Charlton Heston', 'Jack Hawkins', 'Stephen Boyd']",['William Wyler']
434,Children of Heaven (1997) - IMDb,https://m.media-amazon.com/images/M/MV5BZWZlMjNhNzgtZGRhOS00Y2U5LThjOTctODNjZTI0ZTBiYzBhXkEyXkFqcGc@._V1_.jpg,"After a boy loses his sister&apos;s pair of shoes, he goes on a series of adventures in order to find them. When he can&apos;t, he tries a new way to &quot;win&quot; a new pair.",1999-02-16,1H29M,"This translates to MUST-SEE! It&apos;s a credulous incredible storytelling of a young brother and sister in Tehran, and the adventurous saga around one very important pair of sneakers.

The two young actors are amazing -- they play their guileless naïve sensitivity with such earnestness! Central character, Ali, the 9 year old brother, is Mir Farrokh Hashemian, who really carried the film with his legwork, and the younger sister Zahra is Bahareh Seddiqui, who contributed her restrained share of screen presence. The pair is so natural: those furrowed faces, anxious knitted brows -- the range of sad faces the two came up with! The bond between the brother and sister is so warm and joyful - in spite of misfortunes.

The storyline is seemingly simple. Such story-weaving knack writer-director Majid Majidi has -- he can make chasing along a streaming gutter into an intense dramatic episode! The story has the texture likened to a Thomas Hardy novel (poverty setting, episode after episode, turn of events), yet such a relishingly simple delivery. He doesn&apos;t have to tell it all on the screen -- little nuances and observations suffice.

It&apos;s heartening to see young children who are polite and respectful to their elders, responsible and caring in dealing with their everyday problems, and not give up -- such quiet fortitude in spite of disappointments, such tolerance of their circumstance yet still able to find joy in little things. We catch a smile here and there, e.g., when they enjoy the impromptu soap bubbles, or when he encouraged his sister by giving her small tokens.

This is an absolute gem of a family (value) film. Children&apos;s emotions untapped, yet adults are not left out -- touches of  grown-up connections: the parents, the elderly couple next door, the shop-owners, all made this world very real.

The camerawork, and the well-designed use of sound mixed with accompanying music (different tonal quality instruments were applied) complemented this cinematic experience. A poetic ending -- there&apos;s a serenity about it all.

I hope &quot;Children of Heaven&quot; will win this year&apos;s 71st Academy Award Best Foreign Film Oscar -- it will receive its due exposure and more people will experience this gem.

Along the lines of poverty and shoes, I thought of  the Italian 1978&apos;s &quot;The Tree of the Wooden Clogs&quot; by writer-director Ermanno Olmi. And, on a story with substance and good acting by an Iranian young boy, there&apos;s 1989&apos;s &quot;Bashu, The Little Stranger&quot;, by writer-director Bahram Beizai. Both are movies to be appreciated.",https://www.imdb.com/title/tt0118849/,8.2,"['Reza Naji', 'Amir Farrokh Hashemian', 'Bahare Seddiqi']",['Majid Majidi']
435,Barry Lyndon (1975) - IMDb,https://m.media-amazon.com/images/M/MV5BNmM2MGQ5Y2UtYzA3ZC00ZDJlLTkwNDYtMjBmZGExZDJiN2RlXkEyXkFqcGc@._V1_.jpg,An Irish rogue wins the heart of a rich widow and assumes her dead husband&apos;s aristocratic position in 18th-century England.,2009-04-20,3H5M,"Some movies - I wish there were more of them - simply look like a series of great paintings. This film has that look. You could freeze-frame many of the scenes and swear you were looking at a Gainsborough, a Vermeer, a Hogarth or similar work of art by one the great artists of three to five centuries ago. It&apos;s just beautiful.

For that, we have Director Stanley Kubrick and Photographer John Alcott to thank. Being a three-hour movie, there are plenty of wonderful shots to admire, too. In addition, the costumes are lavish and authentic and the scoring is notable. It&apos;s no accident that Oscars were garnered for art/set direction, cinematography, costume design and scoring. Yeah, if you enjoy classical music, you&apos;ll really enjoy the soundtrack, too, under the guidance of conductor Leonard Roseman.

Not to be overlooked is the fine acting and the interesting and underrated story. I say &quot;underrated&quot; because this film, from what I&apos;ve read, bored a lot of people and and it was a box-office flop. That&apos;s too bad because, frankly, I found the story (outside of the first 10--15 minutes) to be fascinating. As I watched, I kept wondering what strange occurrences will happen next to the lead character, &quot;Redmond Barry/Barry Lyndon,&quot; played beautifully by Ryan O&apos;Neal. (For most of the movie, he&apos;s called &quot;Redmond Barry,&quot; so I will refer to him as that.) 

Overall, this was a low-key adventure story about the rise-and-fall of a &quot;scoundrel&quot; back in late 18th century Englishman. &quot;Mr. Barry&quot; is an Irishmen living in England who winds up dealing with a number of people: Irish, English, Prussian, French. His dealings with these people are bizarre at times. While he mainly is shown doing what he can to promote himself, for either monetary gain and prestige of a name and power, he&apos;s not all bad. There is a compassionate side to him, but it only shows itself in small doses. It makes him all the more interesting to watch, because you don&apos;t always know how he&apos;s going to react to his circumstances, which change radically every few years.

We witness his rise to prominence and then his fall when his &quot;sins begin to find him out,&quot; as the Bible would describe. It&apos;s quite a roller coaster ride.

This is an emotional, involving story, and a feast for the eyes and ears. It&apos;s quite different, too, certainly not the average fare from Kubrick. I can only hope this comes out on a high-definition disc some day. Admirers of this film need to see this in all its glory.",https://www.imdb.com/title/tt0072684/,8.1,"['Ryan O&apos;Neal', 'Marisa Berenson', 'Patrick Magee']",['Stanley Kubrick']
436,12 Years a Slave (2013) - IMDb,https://m.media-amazon.com/images/M/MV5BMjExMTEzODkyN15BMl5BanBnXkFtZTcwNTU4NTc4OQ@@._V1_.jpg,"In the antebellum United States, Solomon Northup, a free black man from upstate New York, is abducted and sold into slavery.",2013-09-22,2H14M,"Considering the social and economic importance of slavery in America&apos;s history, the scarcity of serious films depicting the daily life of slaves in the Confederate States is significant - especially since the after-effects from this episode still echo through the culture. &apos;12 Years a Slave&apos; is based upon the memoirs of Solomon Northup, who endured a hellish period of enslavement in Louisiana.

The story begins with him living with wife and children in upstate New York as a free man. After being lured to Washington by a couple of con-artists who promised him work, he was subsequently drugged, chained, beaten, stripped of his identity and shipped to New Orleans to be sold into slavery. Over the next twelve years, he was owned by two men who treated him in contrasting ways. The first was relatively civilized by slave-owner standards, but the plantation&apos;s half-wit manager was threatened by Northup&apos;s superior intelligence. Their mutual dislike produced a volatile situation, and unwilling to lose his investment, Northup&apos;s owner re-sold him to a neighbor. This individual regarded his slaves as property to be used for pleasure and profit, which caused them to live in perpetual fear that his moods would flare into sadistic lust or rage at any moment.

It&apos;s noteworthy that a British director has chosen to tell this story, and the combination of John Ridley&apos;s script and McQueen&apos;s direction has inspired fine performances from the entire cast. Their dramatization of Northup&apos;s experiences is both riveting and uncomfortable to watch, as the film depicts the perverse nature of a society that permitted such barbarism. Hopefully a large US audience will learn how a Southern elite cruelly exploited their fellow humans in order to obtain an easier life for themselves.",https://www.imdb.com/title/tt2024544/,8.1,"['Chiwetel Ejiofor', 'Michael Kenneth Williams', 'Michael Fassbender']",['Steve McQueen']
437,Before Sunrise (1995) - IMDb,https://m.media-amazon.com/images/M/MV5BZDZhZmI1ZTUtYWI3NC00NTMwLTk3NWMtNDc0OGNjM2I0ZjlmXkEyXkFqcGc@._V1_.jpg,"A young man and woman meet on a train in Europe, and wind up spending one evening together in Vienna. Unfortunately, both know that this will probably be their only night together.",2005-02-11,1H41M,"Before Sunrise is romance for the slacker generation. Richard Linklater&apos;s romantic drama is an offbeat telling of a dream come true for most people. The film depicts romance in all it&apos;s glory, but without any of the pitfalls that befall most couples; and in short the film is about two people that have a relationship that&apos;s as close to perfection as relationships will ever come to - with just one problem, the problem of time. While most relationships wind down with time, this one keeps going strong throughout and time itself is the only thing that wears out. Before Sunrise is certainly not the typical sentimental &apos;Hollywood romance&apos;, which is another aspect that puts this film leagues ahead of the pretenders. The story follows two people, Jesse; an American and Celine; a French girl that meet on a train into Vienna. They instantly connect, and after telling her his awful idea for a television show and almost getting off the train, Jesse asks Celine to join him for the day in the picturesque city of Vienna...

Before Sunrise works principally for two reasons - realistic acting and an immense script that builds the characters through their thoughts and feelings and thus allows us to get to know them as we do the people in real life. This allows the characters to be free, and it&apos;s easy to believe that these are real people and not just actors working from a script. This also allows us to feel for the characters for who they are, and not merely because they&apos;re the protagonists. This kind of realism is hard to capture as, at the end of the day, we as the audience know that they&apos;re watching a film and not observing real life; but Before Sunrise represents one of the truest to life exhibitions of realism ever to be seen on screen. A truly great script cannot work on it&apos;s own, and needs great actors to deliver it to an extent that does it justice, and although I&apos;m not a fan of either Julie Deply or Ethan Hawke; on viewing this film, there is nothing you can do but give them both respect. I don&apos;t know whether they were in character or just playing themselves, but when a film is this good; it hardly matters.

In a film like this, it is the writing that&apos;s the most important thing, and contained within the script are several observations about life, most of which I personally could relate to. This represents what Richard Linklater has achieved with this script as not only does it create and build the characters, but it also manages to expose what true love is, along with several other aspects of life. The fact that not all the anecdotes are relatable to me personally again represents the brilliance of writing. Everyone is different, and so different parts of the script will appeal to different people. There could be certain aspects about one person that one person loves and another hates; and that&apos;s the case with the musings in this script. Adding to the beauty of the film is the city of Vienna. The city itself isn&apos;t really important to the film as this is a story that could have taken place just about anywhere - but it makes for some lovely visuals and the upbeat, energetic romance that blossoms throughout the movie is matched by the beauty of the location.

Before Sunrise is simultaneously beautiful and captivating. Richard Linklater has created something that is rare in the world of cinema; a film that captures the beauty of life without ever going over the top or being overly sentimental. Before Sunrise is what it is. And what it is, is pure cinematic brilliance.",https://www.imdb.com/title/tt0112471/,8.1,"['Ethan Hawke', 'Julie Delpy', 'Andrea Eckert']",['Richard Linklater']
438,Blade Runner (1982) - IMDb,https://m.media-amazon.com/images/M/MV5BOWQ4YTBmNTQtMDYxMC00NGFjLTkwOGQtNzdhNmY1Nzc1MzUxXkEyXkFqcGc@._V1_.jpg,A blade runner must pursue and terminate four replicants who stole a ship in space and have returned to Earth to find their creator.,2008-02-02,1H57M,"I spent a weekend with the new DVD set of Blade Runner. Watched all four versions pretty much back to back (minus the work print version) starting with the US theatrical and finishing with the Final Cut. And across those eight hours I spent with the film, I did not get tired of watching – just watching – that futuristic film-noir vibe: deep dark shadows and majestic use of light and color used to make a run-down polluted cityscape look so beautiful. In fact, when I got to the Final Cut, which had been cleaned up, restored, and remixed, the picture and sound quite literally took my breath away.

Blade Runner is easily one of the best looking films ever made.

In some ways, many ways, Blade Runner strikes me as silly. Particularly in its more climactic moments where the protagonist faces off against a replicant. Pris&apos;s acrobatic means of attacking Deckard? When Roy Batty chases Deckard in his shorts (when a few moments before he was fully clothed?) The film goes over-the-top to the point where I find myself asking, &quot;why in the world would the characters do that?!&quot; But here&apos;s what&apos;s interesting: as silly as Blade Runner may get it never betrays its own world. Everything that happens, in some queer way, feels natural to this strange futuristic world.

I like the movie in its action scenes, but I simply adore it during the quieter moments – the parts where not a whole hell of a lot is happening, and you can simply watch and absorb Jordan Cronenweth&apos;s marvelous cinematography. My favorite scene comes when Rachel has saved Deckard&apos;s life. An emotional wreck of killing another replicant on top of the revelation that she, herself, is a replicant – she stands by a window where light floods in, so much light that the whole screen goes white, and then it recedes again and we see the characters again. Later in that same scene, she sits at the piano, plays for a bit, and then lets her hair down. Hearing Deckard stumbling in the other room, she looks out of the corner of her eye  and shot after shot after shot through this entire sequence demonstrates absolute mastery over the frame.

Plus some of the other quiet moments resonate with a truer low-key science-fiction feel such as the scene in Tyrell corporation where Deckard applies the Voight-Kampff test to Rachel. More or less a mundane questionaire/interview with a typical sci-fi gadget sitting on the table, but Ridley Scott and Terry Rawlings compacts the lengthy endeavor into a few short moments using a stunningly simple montage.

Later on, Deckard sits in front of a voice-activated screen analyzing a photograph. The task is presented as a dull monotonous job (made especially evident in Harrison Ford&apos;s delivery), yet the scene, itself, never bores. The voice-activation not only serves as a staple sci-fi device, but cleverly allows Deckard to take the audience&apos;s hand and guide them through this investigative process. And perhaps what I like most about the scene: the audience, and even Deckard himself, doesn&apos;t even really know what he&apos;s found. Things don&apos;t magically fall into place with a Scooby-Doo moment of revelation. He finds another clue that might lead somewhere (albeit, since it&apos;s a movie it&apos;s a good guess the clue does lead somewhere.) In my mind at least moments such as the Voight-Kampff scenes, Deckard&apos;s briefing, the photograph analysis, both of Rachel&apos;s scenes in Deckard&apos;s apartment gives the world of Blade Runner a solid grounding so later on it can get away with the absurd.

Which brings me to the replicants. Roy Batty (Rutger Hauer) in particular, whose strangely sympathetic in that his murderous tendencies spawn directly from his fear of dying. This is a man who possesses a strong conviction that he deserves life perhaps because he looks around on earth and sees people squandering their existence while he knows he only has a few short moments. Why should a shmuck like Deckard live for 50+ years when Roy in his 4 short years has seen attack ships burning off the shoulder of Orion and seen C-beams glitter in the dark  &quot;If only you could see what I&apos;ve seen with your eyes,&quot; he proudly and warmly tells one of the scientists who helped create him.

As for which cut of the film, I don&apos;t think any single one is perfect (and I&apos;d honestly watch any of them in a heartbeat.) I prefer the &quot;Final Cut&quot; over the others and admire Ridley Scott&apos;s restraint in his definitive DVD release. Most of the modifications are fine-tuning tweaks the casual viewer won&apos;t even notice unless watching two version back to back, and most of said fine-tuning improve the film (although, admittingly, Roy&apos;s beckoning of Sebastian could&apos;ve been left out.) But hell, all versions of Blade Runner are included, so people don&apos;t have much room to complain about the changes. And no matter what version you go with, it&apos;s still a beautiful film to just  watch.",https://www.imdb.com/title/tt0083658/,8.1,"['Harrison Ford', 'Rutger Hauer', 'Sean Young']",['Ridley Scott']
