,title,imageUrl,description,dateCreated,duration,reviewBody,movieUrl,starRating,actors,directors
374,Bicycle Thieves (1948) - IMDb,https://m.media-amazon.com/images/M/MV5BMjIzMzAyMzg1Nl5BMl5BanBnXkFtZTgwMzMyNzk0MTE@._V1_.jpg,"In post-war Italy, a working-class man&apos;s bicycle is stolen, endangering his efforts to find work. He and his son set out to find it.",2010-03-23,1H29M,"In the post-war Rome, after more than two-year unemployment, the family man Antonio Ricci (Lamberto Maggiorani) finally finds a disputed job position putting up posters that requires having a bicycle. However, he needs to retrieve his bicycle in the pawn shop but he does not have money. His wife Maria (Lianella Carell) pawns their bed sheets and uses the money to recover the precious bicycle. Antonio envisions a better life for his family with his salary, overtime and benefits. Unfortunately, his bicycle is stolen on the first working day. Antonio and his son Bruno (Enzo Staiola) spend the Sunday chasing the bicycle and the thief on the streets of Rome.

&quot;Ladri di Biciclette&quot; is a heartbreaking masterpiece of the Italian Neo- Realism and one of the best movies of cinema history ever. This is the third time that I watch this unforgettable film that makes me sad with the desperation of Antonio and his lack of perspective in the end. There are memorable touching scenes, like Bruno eating pizza in the restaurant wearing a torn coat and contrasting with the wealthy family; or the happiness of the clumsy Antonio putting up the poster of Rita Hayworth in &quot;Gilda&quot;; or the indecision of Bruno between a dish of soup in the church or chasing the old man with his father; or the shame of Antonio in the end. The DVD released in Brazil by Spectra Nova has good quality of image, subtitles in yellow but no Extras. The DVD released by Versátil uses the same matrix of Spectra Nova but with subtitles in white, and it is difficult the reading by the viewer. However, there are many Extras. My vote is ten.

Title (Brazil): &quot;Ladrões de Bicicleta&quot; (&quot;Thieves of Bicycle&quot;)",https://www.imdb.com/title/tt0040522/,8.3,"['Lamberto Maggiorani', 'Enzo Staiola', 'Lianella Carell']",['Vittorio De Sica']
375,Downfall (2004) - IMDb,https://m.media-amazon.com/images/M/MV5BMTU0NTU5NTAyMl5BMl5BanBnXkFtZTYwNzYwMDg2._V1_.jpg,"Traudl Junge, the final secretary for Adolf Hitler, tells of the Nazi dictator&apos;s final days in his Berlin bunker at the end of WWII.",2004-11-12,2H36M,Der Untergang makes you live the horrors and craziness of war. Bruno Ganz&apos;s interpretation of Adolf Hitler is worthy of an Oscar. He is completely believable. Also the rest of the cast performs admirably. You feel transported to Berlin as it was bombarded by the Russians. You get a very clear insight (or an impression?) in how the military decisions were taken during those final days of the war. The movie balances well between large-scale effects of bombs exploding in ruined streets and depictions of different persons going though the experience  from Hitler and his staff in the well-protected bunkers to the principal military commanders torn between reason and loyalty and German civilians trapped in an inferno. The movie is neither pro-Nazi nor does it depict all Nazis as mindless monsters. It gives an impression of utter realism. Go see it in a good cinema  your seat will tremble as the bombs explode. A nine out of ten.,https://www.imdb.com/title/tt0363163/,8.2,"['Bruno Ganz', 'Alexandra Maria Lara', 'Ulrich Matthes']",['Oliver Hirschbiegel']
376,Dangal (2016) - IMDb,https://m.media-amazon.com/images/M/MV5BMTQ4MzQzMzM2Nl5BMl5BanBnXkFtZTgwMTQ1NzU3MDI@._V1_.jpg,"Mahavir Singh Phogat, a former wrestler, decides to fulfill his dream of winning a gold medal for his country by training his daughters for the Commonwealth Games despite the existing social stigmas.",2020-11-01,2H41M,"Let this incredibly sincere biopic wrestle with your emotions, let it grab you around the waist and smash you through a glass ceiling like no other, let it hold you in its arms and flip you around until your head is spinning. A truly inspirational story of a family, of Geeta Phogat and her sister Babita Kumari, of their father Mahavir Singh Phogat, of the incredible journey, adventure and experience they undertake in order to achieve something spectacular and profound. With breathtaking performances all round, this is one film that will leave you in awe of the incredible things people can achieve in the most challenging of circumstances - an absolutely astonishing piece of film making.",https://www.imdb.com/title/tt5074352/,8.3,"['Aamir Khan', 'Sakshi Tanwar', 'Fatima Sana Shaikh']",['Nitesh Tiwari']
377,Taxi Driver (1976) - IMDb,https://m.media-amazon.com/images/M/MV5BZDNhMGYwM2UtMTdlZS00MGQ1LWI2YzAtODY5YWI1MjYyNzRmXkEyXkFqcGc@._V1_.jpg,"A mentally unstable veteran works as a nighttime taxi driver in New York City, where the perceived decadence and sleaze fuels his urge for violent action.",2004-10-30,1H54M,"A lonely Vietnam veteran who has insomnia spends his nights as a taxi driver in the dirty streets of New York, where he encounters a young prostitute who he tries to help make a difference. 

This is a very good film and one of Martin Scorsese best (Goodfellas being my fave). An excellent portrayal from Robert De Niro as Travis Bickle the cabbie and good performances from Jodie Foster as the child prostitute Iris Steensman, Cybill Shepherd, Peter Boyle and Harvey Keitel as a pimp called Sport. 

You actually get drawn into the isolation and anger that Travis is feeling towards these lowlifes and because of that you really feel sympathy for him. Though after a while the loneliness and the city really starts to haunt Travis&apos;s mind, causing violent instincts and paranoia. 

This film is filled with such memorable lines e.g.Travis Bickle &apos;You talking to me? Well I&apos;m the only one here.&apos; and the many powerful scenes that stay in your head after it&apos;s finished. The hypnotic cinematography is a standout, as if your seeing the harsh &amp; gritty New York streets and twisted people through the eyes of Travis when he is driving his cab. A great screenplay, a stunning score by Bernard Herrmann and a superb atmosphere created. 

This is a brutally compelling and bleak look at a decaying and corrupt society of the 70&apos;s. An unsettling gem of a film. 

5/5",https://www.imdb.com/title/tt0075314/,8.2,"['Robert De Niro', 'Jodie Foster', 'Cybill Shepherd']",['Martin Scorsese']
378,Hamilton (2020) - IMDb,https://m.media-amazon.com/images/M/MV5BYzBhOWY4ZTktMjE2NS00ZGIyLWJkOGMtNDQyN2JjZWFiODdiXkEyXkFqcGc@._V1_.jpg,"The real life of one of America&apos;s foremost founding fathers and first Secretary of the Treasury, Alexander Hamilton. Captured live on Broadway from the Richard Rodgers Theater with the original Broadway cast.",2020-07-04,2H40M,"I started watching this out of curiosity and to say I have seen it, being the cultural touchstone that it is. At first, I was a little detached, not liking the songs too much, and thinking I would probably just skip through to end in a minute. I couldn&apos;t stop watching and it really sucked me in. I have to say, I&apos;m not sure I would have enjoyed it at all, live in the theater. I benefited greatly from the captions and the ability to put it on pause to consult Wikipedia from time to time. The lyrics were so clever and really told the story. I ended up very moved and almost cheering at the end. Of course, now that I am familiar with the story, I would love to see it live and would enjoy it immensely. But I would strongly recommend this for a first time viewing. I will definitely re-watch. And probably again and again.",https://www.imdb.com/title/tt8503618/,8.3,"['Lin-Manuel Miranda', 'Phillipa Soo', 'Leslie Odom Jr.']",['Thomas Kail']
379,The Wolf of Wall Street (2013) - IMDb,https://m.media-amazon.com/images/M/MV5BMjIxMjgxNTk0MF5BMl5BanBnXkFtZTgwNjIyOTg2MDE@._V1_.jpg,"Based on the true story of Jordan Belfort, from his rise to a wealthy stock-broker living the high life to his fall involving crime, corruption and the federal government.",2018-10-24,3H,"It&apos;s no surprise that Scorsese is associated with the gangster genre with films such as The Departed, Goodfellas and Casino, of which the last two are possibly the best pure examples of the genre. In Goodfellas the gangsters are dangerous but they operate on a more underground level, in Casino they practically run a major city and can do whatever they like. The gangsters were and will always be a part in America&apos;s system. Now, the gangsters are not just accepted by the system, but are considered to be an integral part of it. In the first two films, the gangster is threatening and dangerous, but avoidable. In The Wolf of Wall Street, he&apos;s calling to hustle you at home and you don&apos;t even know it. Some people view The Wolf of Wall Street as a glorification of Jordan Belfort&apos;s lifestyle and want to be like him, as Scorsese portrays this life by its nature, enticing. That&apos;s the way it works, and it&apos;s impossible to portray it accurately without showing how a charismatic man like Belfort can suck an unsuspecting person into a world of money and fame. The film though, shows us just how empty and destructive that life can be.

There is an undeniable similarity between the instantaneous joy, energy and euphoria that we have while watching The Wolf of Wall Street and how Jordan Belfort lives his life, this is a movie where the director skillfully mixes form and content to create an experience which is as hyper and as instantly ecstatic as the life of its flashy and opportunistic characters.

The direction by Martin Scorsese which still has infectious energy and power is impeccable, there is no other director who has mastered pacing like he has. This is a three-hour movie that moves lightning fast and always manages to keep the audience invested in the story throughout the whole duration. Each scene is packed with so much visual information, and it is fast paced and quickly edited, which complements the general tone of the film. The cinematography by Rodrigo Prieto is gorgeous as well and displays an optimal color palette throughout the whole film. Each shot also looks precise, even during some of the more chaotic scenes.

The script is fantastic, filled with many great and memorable lines of dialogue. Every character has a well-defined arc and motives, and the story is given proper breathing room to blossom. The performances are also exquisite, especially Leonardo DiCaprio who gives one of the best performances of his career and portrays the opportunistic nature of Jordan Belfort&apos;s character with great commitment as you can see a lustful, hedonistic and impulsive sex &amp; drug-addict man who only wants to have more fun. Supporting him with equal passion is Jonah Hill as Donnie Azoff, Belfort&apos;s sidekick, and even he manages to make a mark of his own. Margot Robbie plays Naomi, Belfort&apos;s second wife and she does an alluring job in her given role. Matthew McConaughey is in for a very short duration as Mark Hanna, Belfort&apos;s mentor, but even in that little time, he is the show-stealer and he dominates the screen unlike anyone else.

Martin Scorsese and Terence Winter set out to create a film about the Wall Street excess, and by definition, it contains an excessive amount of everything, such as cursing, sex, nudity, drugs, alcohol and partying. But the film is not really about those things. The story of The Wolf of Wall Street boils down to money, that &quot;most-addictive drug&quot; Belfort speaks of, and not just what it can buy, but what it can do to people. Not just how it changes one&apos;s lifestyle but the effects it has on one&apos;s morals, beliefs, and values, and how it can effectively change not just how a person thinks and feels but how they operate at their core.

With a collection of truly incredible films, The Wolf of Wall Street stands out as one of Scorsese&apos;s best films, my personal favorite and by far his most humorous film to date. He truly went all out and it paid off in a hilarious satire on the reverence of money, drugs, women, and the admiration of a criminal money-maker. The Wolf of Wall Street is maddening cinema that&apos;s already high on coke but still continues to snort more white powder every 5 minutes for 3 hours. This is a fascinating vignette of excess, greed, abuse and decay and it&apos;s one of the best movies of the decade and surely one of the most entertaining movies ever made.",https://www.imdb.com/title/tt0993846/,8.2,"['Leonardo DiCaprio', 'Jonah Hill', 'Margot Robbie']",['Martin Scorsese']
380,Batman Begins (2005) - IMDb,https://m.media-amazon.com/images/M/MV5BODIyMDdhNTgtNDlmOC00MjUxLWE2NDItODA5MTdkNzY3ZTdhXkEyXkFqcGc@._V1_.jpg,"After witnessing his parents&apos; death, billionaire Bruce Wayne learns the art of fighting to confront injustice. When he returns to Gotham as Batman, he must stop a secret society that intends to destroy the city.",2006-04-13,2H20M,"To start off this review I&apos;d like to go back to the original batman series. Adam West hammed it up in what has to be the campest yet enjoyable version of batman. It was cheesy, it had the POW, WHACK, KABOOM, very very tongue-in-cheek which, brings me to my next point, is what batman eventually became. Batman, featuring Michael Keaton was a good film, keaton was a good batman, he portrayed the dark knight to a whole new army of fans, a darker batman, less camp, plus with a villain such as Jack Nicholson (turning in another great performance) as the Joker it was win win. Where from there? A sequel, Keaton yet again, Batman Returns, not as good as its predecessor but still a thoroughly enjoyable film with the villains being Penguin (Devito) and Catwoman (Pfeiffer) adding something different to the batman series. All is going well, then things start to go sour. Keaton is gone and in comes Kilmer who has to be the most wooden Batman ever, in come the clichés, the tongue in cheek one-liners and so on but Batman still has some credibility until, dare I mention it, Batman &amp; Robin. This ruined the Batman series with Clooney just being the eye-candy for the ladies, the addition of Batgirl (oh dear Lord) and the villains just coming out with the most tongue-in-cheek one liners ever, example Mr Freeze &quot;You&apos;re not sending me to the cooler&quot;, wrong, oh so wrong. Something had to be done and this was Batman Begins. This film rescues the Batman series single-handedly, it&apos;s a shame it didn&apos;t start off this way as it might not of died on it&apos;s rear. Bale is an inspired choice as Batman bringing a more serious side to Batman, the story is well paced, it&apos;s not all talk or just mind-numbing action, it actually keeps you gripped as you want to find more about Bruce Wayne&apos;s past. The only reason it misses out on a 10 is the quite pitiful bad guy scarecrow If you&apos;ve not seen it I don&apos;t want to give too much away about the story but throw away all your perceptions about Batman because Batman is back and Batman has truly begun. D-man.",https://www.imdb.com/title/tt0372784/,8.2,"['Christian Bale', 'Michael Caine', 'Ken Watanabe']",['Christopher Nolan']
381,Green Book (2018) - IMDb,https://m.media-amazon.com/images/M/MV5BNDU5YTNmMmItN2QxNy00OGQ0LTg5MTctNzFmYjEzZjcwN2UwXkEyXkFqcGc@._V1_.jpg,A working-class Italian-American bouncer becomes the driver for an African-American classical pianist on a tour of venues through the 1960s American South.,2019-01-02,2H10M,"Outstanding true story film showing that color doesn&apos;t define us, but how we act ourselves and towards others, does.

Great performances from the entire cast, especially Viggo Mortensen and Mahershala Ali who were perfectly cast and convincing in their roles. It was also great to see comedian Sebastian Maniscalco in this film as well.

Writer, director and producer Peter Farrelly nailed every aspect of this biography.

The score, cinematography, sets and visuals were all on point.

I&apos;m not a fan of slow paced long films, but this was was close to an exception. I feel if the pace was picked up a bit and/or the 130 min run-time edited down to around 110 mins, this would have been a perfect 10 from me.

Excellent drama and comedy perfectly positioned throughout the film.

A well deserved 8/10 from me.",https://www.imdb.com/title/tt6966692/,8.2,"['Viggo Mortensen', 'Mahershala Ali', 'Linda Cardellini']",['Peter Farrelly']
382,For a Few Dollars More (1965) - IMDb,https://m.media-amazon.com/images/M/MV5BNTRmOTcyYmYtMTIwNi00ZGYyLTk4YjYtZGJlZTgwZGY0NGQyXkEyXkFqcGc@._V1_.jpg,Two bounty killers with similar intentions but different motivations team up to track down a psychotic Mexican outlaw before he and his gang can carry out an audacious bank robbery.,2013-09-21,2H12M,"Col. Douglas Mortimer (Lee Van Cleef) and Monco (Clint Eastwood) are both bounty hunters. They&apos;re both after the bank robber El Indio (Gian Maria Volonté) for his bounty. They decide to join forces to bring El Indio and his gang of robbers down.

Lee Van Cleef makes this a superior spaghetti western. He&apos;s not only as good as Clint. In many ways, he plays a superior character. His character has secrets. He has mysteries. Clint is playing a much more simpler character. For me, this is superior to &apos;A Fistful of Dollars&apos; in the trilogy. The story is more iconic, cleaner. The characters have more depth.",https://www.imdb.com/title/tt0059578/,8.2,"['Clint Eastwood', 'Lee Van Cleef', 'Gian Maria Volontè']",['Sergio Leone']
383,Some Like It Hot (1959) - IMDb,https://m.media-amazon.com/images/M/MV5BZTllZDYyNjEtY2RmMS00NmJhLWI4ODAtMTQ0NWFiZTJhZjA0XkEyXkFqcGc@._V1_.jpg,"After two male musicians witness a mob hit, they flee the state in an all-female band disguised as women, but further complications set in.",2012-10-30,2H1M,"Legendary comedy masterpiece from filmmaker Billy Wilder and IAL Diamond that Won Oscar and another 13 wins &amp; 8 nominations . Immensely charming comedy set among Chicago and Miami , being starred by an all-star-cast . When two unemployed musicians witness a mob hit , the St Valentine massacre in Chicago carried out by mobster chief (George Raft) they flee the state in an all female band disguised as women and headed for Florida , but further complications set in. There appears a gorgeous singer , Sugar Kane (Marilyn Monroe) , who is object of pursuit by the musicians (Jack Lemmon , Tony Curtis) who cannot reveal their identity because are dressed as women in order to getaway from killer gangsters&apos; retaliation . 

Rightly enjoyable and fun-filled , milestone comedy which neatly combines humor , mirth , entertaining situations and amusement . This noisy comedy is intelligently and pleasingly written to gives us lots of fun , laughters and smiles . Mordantly funny , though by time of premiere was rated as bad taste and some discomfort ; however , is todays considered a real classic movie . Billy Wilder kept the studio Paramount happy , the picture consistently made money and was hit at box office . Flawless comedy with a trio of sensational protagonists , including an unforgettable Marilyn who parades sexily at her best and more relaxed and enticing than ever . The hit of the show is undoubtedly for the fetching Marilyn Monroe who gives one of the best screen acting and sings marvelous songs as ¨Running wild¨, ¨I&apos;m through with love¨ and the immortal ¨I wanna be loved you¨. Magnificent performances from Jack Lemmon as angst-ridden musician dressed in drag and sensational Tony Curtis as a philander young , playing his Gary Gray Grant impression . Furthermore , a splendid secondary cast , a variety of notorious actors who make sympathetic interpretations such as Pat O&apos;Brien , George Raft , Mike Mazurski , Nehemia Persoff and , of course, smitten Joe E Brown , including his now-classic closing line . 

The motion picture was very well directed by Billy Wilder who includes several punchlines . Billy was one of the best directors of history . In 1939 started the partnership with Charles Bracket on such movies as ¨Ninotchka¨ , ¨Ball of fire¨ , making their film debut as such with ¨Major and the minor¨ . ¨Sunset Boulevard¨ was their last picture together before they split up . Later on , Billy collaborated with another excellent screenwriter IAL Diamond . Both of them won an Academy Award for ¨Stalag 17¨ dealing with a POW camp starred by William Holden . After that , they wrote/produced/directed such classics as ¨Ace in the hole¨ , the touching romantic comedy ¨Sabrina¨ , the Hickcoktian courtroom puzzle game ¨Witness for the prosecution¨ and two movies with the great star Marilyn Monroe , the warmth ¨Seven year itch¨ and this ¨Some like hot¨. All of them include screenplays that sizzle with wit . But their biggest success and highpoint resulted to be the sour and fun ¨¨The apartment¨. Subsequently in the 60s and 70s , the duo fell headlong into the pit , they realized nice though unsuccessful movies as ¨Buddy buddy¨ ,¨Fedora¨ , ¨Front page¨ and ¨Secret life of Sherlock Holmes¨, though the agreeable ¨Avanti¨ slowed the decline . The team had almost disappeared beneath a wave of bad reviews and failures . ¨Some like hot¨ rating : Above average , essential and indispensable watching ; extremely funny and riveting film and completely entertaining . It justly deserves its place among the best comedy ever made . One of the very funniest films of all time and to see and see again . It&apos;s the kind of movie where you know what&apos;s coming but , because the treatment , enjoy it all the same .",https://www.imdb.com/title/tt0053291/,8.2,"['Marilyn Monroe', 'Tony Curtis', 'Jack Lemmon']",['Billy Wilder']
384,The Truman Show (1998) - IMDb,https://m.media-amazon.com/images/M/MV5BNzA3ZjZlNzYtMTdjMy00NjMzLTk5ZGYtMTkyYzNiOGM1YmM3XkEyXkFqcGc@._V1_.jpg,An insurance salesman begins to suspect that his whole life is actually some sort of reality TV show.,2020-03-31,1H43M,"The script is very creative, doubting that this is not a movie at all, but a complete realization at the end of life; to the so-called real world, although there are lies and hurt, but cruel truth is always better than false content; The mediocre person never notices.",https://www.imdb.com/title/tt0120382/,8.2,"['Jim Carrey', 'Ed Harris', 'Laura Linney']",['Peter Weir']
385,Judgment at Nuremberg (1961) - IMDb,https://m.media-amazon.com/images/M/MV5BNDc2ODQ5NTE2MV5BMl5BanBnXkFtZTcwODExMjUyNA@@._V1_.jpg,"Fictionalized depiction of the 1947 Judges&apos; Trial, the third of twelve trials of Nazi war criminals conducted by the American occupying forces in Nuremberg, Germany, in which former judges of Nazi Germany were tried for their acti...",2006-10-09,2H59M,"I have always been fond of Stanley Kramer&apos;s work , but this movie proved to be quite extraordinary and exceptional .The movie has every thing you can desire and human sentiments are at there level best. The plot is written by Abby Mann who won best screenplay Oscar from that and quite deserving one. The story based on Nuremberg trials held after fall of Nazi&apos;s in Germany but this movie is nice blend of history with fiction as the major characters were fictional but the evidences and indictments presented in the trial ever authentic and truly depicts the conditions of Nazi occupied Germany. The most intriguing thing of the movie was the true representation of aftermaths of Nazi&apos;s occupation in Germany and the feeling of German toward the trial and immaculate direction of Kramer made possible to convey these types of sentiment on cinema for the very first time. The cast was also fascinating with big names like Tracy and surely he did justice with his role as he was very compelling and humble as Judge Haywood. Maximilian Schell was at his best as a compassionate enthusiastic zealous and patriotic attorney to defend the dignity of Nation. He won best actor Oscar for his role. Montgomery Clift was also the one who made this movie special as he played a role of feeble minded sterile man who was nominated for best actor in supporting role though he only played for 9 min in the movie. Burt Lancaster gave one of the most extraordinary cinematic performances as Ernst Janning. This is one of those movies which provokes our mentality and also our morality and is a treat to watch.",https://www.imdb.com/title/tt0055031/,8.3,"['Spencer Tracy', 'Burt Lancaster', 'Richard Widmark']",['Stanley Kramer']
386,The Kid (1921) - IMDb,https://m.media-amazon.com/images/M/MV5BNjkxMzY1NTQtN2YwOS00NmIwLTlkNTMtMjNkMzk1ZTk3ZDU2XkEyXkFqcGc@._V1_.jpg,"The Tramp cares for an abandoned child, but events put their relationship in jeopardy.",2003-10-18,1H8M,"Charlie Chaplin&apos;s study of a tramp teaming up with a street kid (the cute little Jackie Coogan) has a fine line to tread between humour and pathos, and true to what you would expect of his best work, does it superbly.  The tramp always manages to wring the hearts of his viewers and adding a little boy to the mix was the finishing touch.  Look out too for little Lita Grey in the angel sequence, who would become Chaplin&apos;s 2nd wife four years after this film was made.",https://www.imdb.com/title/tt0012349/,8.2,"['Charles Chaplin', 'Edna Purviance', 'Jackie Coogan']",['Charles Chaplin']
