,title,imageUrl,description,dateCreated,duration,reviewBody,movieUrl,starRating,actors,directors
313,Paths of Glory (1957) - IMDb,https://m.media-amazon.com/images/M/MV5BNmQ2NmI2ODYtMDQzNS00NzQyLTkzZjgtZmZlYTQ5MTc1OWU3XkEyXkFqcGc@._V1_.jpg,A colonel defends three of his soldiers in a court-martial after they abandon a suicidal attack.,2006-10-15,1H28M,"Although Kubrick&apos;s films are marked by their massive variation of genre and tone, one theme that crops up again and again is a strong anti-war sentiment, and this was never stated more strongly than in Paths of Glory. A relatively early Kubrick picture and, despite coming before what is considered his classic period, it is one of his best.

In contrast to his previous picture, The Killing, a definite Kubrick style is beginning to emerge now. One notable example is the scene in which General Mireau tours the trenches, walking towards the audience with the camera retreating away from him. This technique would be repeated years later in Kubrick&apos;s other war film, Full Metal Jacket. There is also something about the arrangement of objects in the frame, as well the tracking and dollying which hints towards his more familiar later style. His recurring chess motif appears as well, albeit subtly. At the court martial the floor is chequered, and the soldiers on trial are seated with guards standing behind them as if they are pawns about to be sacrificed.

The light and contrast in this picture is put to good effect. The palatial officers&apos; headquarters is light and airy with few shadows. The trenches are gloomy and cramped. Kubrick was becoming a real master at contrasting locations and getting the look of a place just right.

The use of music in Paths of Glory is bold and brilliant. The pre-recorded score is almost entirely percussive  all rhythmic sounds with no melody. A weird kettle drum track is used to help build tension in the night patrol scene, while in the climactic scene the funeral march drumming instills a sense of dread, further heightened by having the shots edited in time to the beat. In the emotional final scene we get the complete opposite  a beautiful vocal melody. This has all the more impact after hearing nothing but militaristic drums for the rest of the film.

The casting is absolutely flawless. While there are no big names apart from leading man Kirk Douglas and the now elderly Adolphe Menjou, there isn&apos;t a single weak performance. The despair and resentment of the condemned soldiers feels so absolutely real. In contrast the smugness and fake sympathy of the upper class officers is brilliantly portrayed.

Throughout his career Kubrick never seemed to be particularly keen on blatantly emotional moments. Paths of Glory is the exception. The later scenes are incredibly poignant and moving, and the final moments in the soldier&apos;s bar are what makes it a masterpiece more than anything else  the icing on the cake. However it&apos;s quite probable that Kubrick regretted this as an overly sentimental approach, as woolly sentimentalism was a major gripe of his when he worked on Spartacus. Whatever the case, he certainly reined in the stirring stuff considerably after this, to the point where his later films became characterised by their understatement of emotions.",https://www.imdb.com/title/tt0050825/,8.4,"['Kirk Douglas', 'Ralph Meeker', 'Adolphe Menjou']",['Stanley Kubrick']
314,Witness for the Prosecution (1957) - IMDb,https://m.media-amazon.com/images/M/MV5BNjRhNTQzMzQtMWViMi00ODQ1LTg0MTEtYWE4ZWZlYjM4YjJhXkEyXkFqcGc@._V1_.jpg,A veteran British barrister must defend his client in a murder trial that has surprise after surprise.,2005-11-08,1H56M,"This is one of the best &quot;trial movies&quot; ever made. It&apos;s an outstanding film that is just as good today as it was almost 50 years ago when it was released in the theaters. The shocking ending caused quite a stir back then, too.

The only part of the movie I thought looked dated and unrealistic was Tyrone Power&apos;s character being able to interrupt the trial with outbursts and not be reprimanded for it. There is no way that would be tolerated, at least today.

Otherwise, it&apos;s a pretty solid film with a good cast that includes two fascinating characters played by actors who know how to entertain: Charles Laughton and Marlene Dietrich. 

Laughton, who plays Power&apos;s defense attorney, grabs the spotlight in the story but Dietrich almost steals the movie in her role as Power&apos;s wife. Laughton&apos;s dialog is terrific throughout, bringing a number of laughs to this serious film. He&apos;s just a joy to watch. Dietrich is even more riveting but just doesn&apos;t have anywhere near the same amount of screen time as Laughton.

Not to be overlooked is Elsa Lanchester, playing Laughton&apos;s nurse. She, too, demonstrates her comedic talent and significantly adds to the fun of watching this film.

If you like some fine drama, storyline twists, a little humor thrown in and great acting and dialog, this is a classic film to check out.",https://www.imdb.com/title/tt0051201/,8.4,"['Tyrone Power', 'Marlene Dietrich', 'Charles Laughton']",['Billy Wilder']
315,The Shining (1980) - IMDb,https://m.media-amazon.com/images/M/MV5BNmM5ZThhY2ItOGRjOS00NzZiLWEwYTItNDgyMjFkOTgxMmRiXkEyXkFqcGc@._V1_.jpg,"A family heads to an isolated hotel for the winter, where a sinister presence influences the father into violence. At the same time, his psychic son sees horrifying forebodings from both the past and the future.",2000-08-27,2H26M,"When this film first came out in 1980, I remember going to see it on opening night. The sheer terror that I experienced in viewing &quot;The Shining&quot; was enough to make me go to bed with the lights turned ON every night for an entire summer. This movie just scared the life out of me, which is what still happens every time I rent the video for a re-watch. I have seen The Shining at least six or seven times, and I still believe it to be simultaneously and paradoxically one of the most frightening and yet funniest films I&apos;ve ever seen. Frightening because of the extraordinarily effective use of long shots to create feelings of isolation, convex lens shots to enhance surrealism, and meticulously scored music to bring tension levels to virtually unbearable levels. And &quot;funny&quot; because of Jack Nicholson&apos;s outrageous and in many cases ad-libbed onscreen antics. It never ceases to amaze me how The Shining is actually two films in one, both a comedy AND a horror flick. Ghostly apparitions of a strikingly menacing nature haunt much of the first half of the film, which gradually evolve into ever more serious physical threats as time progresses. Be that as it may, there is surprisingly little violence given the apparent intensity, but that is little comfort for the feint of heart as much of the terror is more implied than manifest. The Shining is a truly frightening movie that works symbolically on many levels, but is basically about human shortcomings and the way they can be exploited by unconscious forces combined with weakness of will. This film scares the most just by using suggestion to turn your own imagination against you. The Shining is a brilliant cinematic masterpiece, the likes of which have never been seen before or since. Highly, highly recommended. - Paul",https://www.imdb.com/title/tt0081505/,8.4,"['Jack Nicholson', 'Shelley Duvall', 'Danny Lloyd']",['Stanley Kubrick']
316,The Great Dictator (1940) - IMDb,https://m.media-amazon.com/images/M/MV5BMjc4ZjEwNDUtMjlmZS00NzQ4LTg2N2MtMGI3ZjMyMmM3ZDM2XkEyXkFqcGc@._V1_.jpg,Dictator Adenoid Hynkel tries to expand his empire while a poor Jewish barber tries to avoid persecution from Hynkel&apos;s regime.,2017-08-05,2H5M,"The tagline of &apos;The Great Dictator&apos; is &apos;the comedy masterpiece&apos;, and I couldn&apos;t think of a better line to sum this film up. It&apos;s a hilarious political satire, but it also delivers a vitally important message. This film was released at the time when Hitler was at the height of his power and the main character, dictator Hynkel, is obviously a reference to him.

Charlie Chaplin is simply outstanding in this film in what was his first spoken role. To play two completely different characters, Hynkel and the Jewish barber, so convincingly in the same film is truly remarkable. Chaplin&apos;s speech at the end, which is very much HIS speech even though he&apos;s playing a character, is a piece of cinema I will never forget. Such a powerful, moving and compelling speech that remains relevant even today.

Making a comedy out of such a tragedy is risky business, but Chaplin&apos;s anti-fascist message ensured it wasn&apos;t taken the wrong way. &apos;The Great Dictator&apos; is a hilarious but meaningful and powerful film. A brilliant piece of cinema.",https://www.imdb.com/title/tt0032553/,8.4,"['Charles Chaplin', 'Paulette Goddard', 'Jack Oakie']",['Charles Chaplin']
317,12th Fail (2023) - IMDb,https://m.media-amazon.com/images/M/MV5BNTE3OTIxZDYtNjA0NC00N2YxLTg1NGQtOTYxNmZkMDkwOWNjXkEyXkFqcGc@._V1_.jpg,The real-life story of IPS Officer Manoj Kumar Sharma and IRS Officer Shraddha Joshi.,2023-10-27,2H27M,"12th Fail is a bold movie and movies like this must be made more frequently.

Alas, nowadays making such movies isn&apos;t possible easily because masses are more inclined to watch poorly made but highly promoted movies like Kashmir Files or Kerala story.

This will surely inspire many and will give morale boost to many aspirants and will give it&apos;s viewer to think after watch.

Direction is superb and acting of Vikrant Messy is top notch.

All Hail Vikrant Massey &amp; Vidhu Vinod Chopra As They Shape The Most Pure, Personal &amp; Brave Hindi Film In A Long Time.

12th Fail deserves an audience, and we, as cinephiles, deserve cinema that respects us. Vidhu Vinod Chopra and Vikrant Massey have served one.",https://www.imdb.com/title/tt23849204/,8.8,"['Vikrant Massey', 'Medha Shankr', 'Anant Joshi']",['Vidhu Vinod Chopra']
318,Aliens (1986) - IMDb,https://m.media-amazon.com/images/M/MV5BZjIyNGJhYzYtN2I1My00OTVhLWEyMzItZTVjNDMzOTVkYWViXkEyXkFqcGc@._V1_.jpg,"Decades after surviving the Nostromo incident, Ellen Ripley is sent out to re-establish contact with a terraforming colony but finds herself battling the Alien Queen and her offspring.",1998-08-14,2H17M,"THE sci-fi movie. It&apos;s nearly perfect in every way: storyline, characters, menacing threat, suspense, action, direction, music, emotion, etc... It&apos;s always been a favorite of mine and still is. To me this is not just a film, it is an experience. The adrenaline pumps like in no other film and rarely have we had the chance to see a heroine as compelling as Sigourney Weaver. She can kick anyone&apos;s ass and still keep a heart and soul. (Why she didn&apos;t win the Oscar back in 1986 is beyond me.) When the action starts, you&apos;re in for the ride of your life. Truly a milestone in movie making. Now if they could only release it on DVD...",https://www.imdb.com/title/tt0090605/,8.4,"['Sigourney Weaver', 'Michael Biehn', 'Carrie Henn']",['James Cameron']
319,Inglourious Basterds (2009) - IMDb,https://m.media-amazon.com/images/M/MV5BODZhMWJlNjYtNDExNC00MTIzLTllM2ItOGQ2NGVjNDQ3MzkzXkEyXkFqcGc@._V1_.jpg,"In Nazi-occupied France during World War II, a plan to assassinate Nazi leaders by a group of Jewish U.S. soldiers coincides with a theatre owner&apos;s vengeful plans for the same.",2021-10-10,2H33M,There are a lot of ambiguities in this film)Marvel 45 years old) it is quite possible to spend an evening and watch for 1 time.,https://www.imdb.com/title/tt0361748/,8.4,"['Brad Pitt', 'Diane Kruger', 'Eli Roth']",['Quentin Tarantino']
320,The Dark Knight Rises (2012) - IMDb,https://m.media-amazon.com/images/M/MV5BMTk4ODQzNDY3Ml5BMl5BanBnXkFtZTcwODA0NTM4Nw@@._V1_.jpg,"Bane, an imposing terrorist, attacks Gotham City and disrupts its eight-year-long period of peace. This forces Bruce Wayne to come out of hiding and don the cape and cowl of Batman again.",2021-02-16,2H44M,"&apos;The Dark Knight Rises&apos; is the third and final instalment in Christopher Nolan&apos;s groundbreaking trilogy that reshaped the superhero genre as we know it. The main cast return as well as some newcomers. Tom Hardy as &apos;Bane&apos;, Anne Hathaway as &apos;Selina&apos;, Joseph Gordon-Levitt as &apos;Blake&apos; and Marion Cotillard as &apos;Miranda&apos;. The new additions are fantastic, especially Tom Hardy. He brings a menacing presence to the character and finally incorporates the main part of his comic counterpart, his brains. For sure Bane is incredibly strong, but he is also an unbelievable strategist that can systematically wear down Batman whilst also using his strength to defeat him. Hardy displays all of this perfectly despite us barely seeing his face, the mask he wears makes him more frightening and is used as an interesting plot device later in the film. A lot of people criticised the voice that Hardy uses for this character, but personally I love it, I think adds to the mystery of the figure. The best acting comes from Michael Caine as &apos;Alfred Pennyworth&apos;. Nolan really fleshes out Alfred and Bruce&apos;s relationship in this film and Caine plays the reluctant mentor figure perfectly. One of his final scenes really shows off his acting, the regret that Alfred pours out and it&apos;s heartbreaking. Whilst all of the other actors are great, Caine excels in this movie compared to &apos;Batman Begins&apos; and &apos;The Dark Knight&apos;. The writing is brilliant, so many twists and turns and a sensational ending that really brings the trilogy full circle and has a great ending to Bruce&apos;s arc. The dialogue is excellent, in particular the many Bane monologues that add another layer onto his great character. The fight choreography improves massively and is loads better than the last two films. Hanz Zimmers score is superb and works in all scenes that it features in. Also, the cinematography is beautiful, Wally Pfister, who has worked with Nolan throughout the trilogy, really peaks in this picture. However, this movie isn&apos;t perfect, Bane&apos;s final demise is very underwhelming, especially for a character that makes as much of an impact as he does. Finally the twist at the end with Blake feels tacked on and is inaccurate to the source material. Overall, I love this movie, for sure it doesn&apos;t live up to the heights of &apos;The Dark Knight&apos; but it is still exceptional and was a stunning way to end this unbelievable series of films.

9/10",https://www.imdb.com/title/tt1345836/,8.4,"['Christian Bale', 'Tom Hardy', 'Anne Hathaway']",['Christopher Nolan']
321,Coco (2017) - IMDb,https://m.media-amazon.com/images/M/MV5BMDIyM2E2NTAtMzlhNy00ZGUxLWI1NjgtZDY5MzhiMDc5NGU3XkEyXkFqcGc@._V1_.jpg,"Aspiring musician Miguel, confronted with his family&apos;s ancestral ban on music, enters the Land of the Dead to find his great-great-grandfather, a legendary singer.",2017-12-01,1H45M,"I knew absolutely nothing about this movie walking in, the only reason I was there was to take my daughter to see it is strictly because my wife said there was a short Frozen film that played along with the movie and my daughter just so happens to be the biggest Frozen fan on the face of the planet.

Not only was I surprised by Coco, it might be the most in depth best story line I&apos;ve ever seen in an animated movie. It was also educational and shed an entirely new light on the background of the Mexican holiday Dia De Los Muertos.

Wonderful movie, can&apos;t say enough good things about it!",https://www.imdb.com/title/tt2380307/,8.4,"['Anthony Gonzalez', 'Gael García Bernal', 'Benjamin Bratt']","['Lee Unkrich', 'Adrian Molina']"
322,Amadeus (1984) - IMDb,https://m.media-amazon.com/images/M/MV5BMzc2MjM0NTMtOGY4NC00NzY1LWE2ODUtZjMzY2RhNGNkZDAyXkEyXkFqcGc@._V1_.jpg,"The life, success and troubles of Wolfgang Amadeus Mozart, as told by Antonio Salieri, the contemporaneous composer who was deeply jealous of Mozart&apos;s talent and claimed to have murdered him.",2004-05-23,2H40M,"I thought that it would be impossible to make a movie like this one! Peter Schaffer&apos;s original play inspired Milos Forman, the great czech film maker, that surprised the world with &quot;One flew over the cuckoo&apos;s nest&quot; (1975). The sublime, almost over-human performance by Frank Murray Abraham (the Mozart enemy and secret admirer, Salieri) is one of the keys for the movie success, mostly to it&apos;s depth. The perfect sense of timing by Milos Forman is admirable, he knows when to play wich music. All the scenarios: opera houses, palaces, streets, etc., are details absolutely harmonious! One of this classic secret was that Forman gathered &quot;the&quot; team, perfect team work.

We can just admire it, laugh, cry, reflect, most of all, listen to it. See it, it&apos;s 10/10.

Thank you Mr. Forman...",https://www.imdb.com/title/tt0086879/,8.4,"['F. Murray Abraham', 'Tom Hulce', 'Elizabeth Berridge']",['Milos Forman']
323,Toy Story (1995) - IMDb,https://m.media-amazon.com/images/M/MV5BZTA3OWVjOWItNjE1NS00NzZiLWE1MjgtZDZhMWI1ZTlkNzYwXkEyXkFqcGc@._V1_.jpg,A cowboy doll is profoundly threatened and jealous when a new spaceman action figure supplants him as top toy in a boy&apos;s bedroom.,2004-12-25,1H21M,"I am a big fan of the animated movies coming from the Pixar Studios. They are always looking for the newest technological possibilities to use in their movies, creating movies that are more than just worth a watch, even when they were made a decade ago.

The movie is about toys that come to life when their owner is asleep or not in the same room. When the young boy&apos;s birthday is coming up, all the toys are nervous. They don&apos;t want to be ignored when the new one arrives. Woody the cowboy is their &quot;leader&quot; because he&apos;s the most popular one of them all. He&apos;s the only one that hasn&apos;t got to be afraid, but than a new favorite arrives ... Buzz Lightyear. He hates him and tries everything possible to get rid of him, but as the time passes by they learn to appreciate each other...

When you see Toy Story, you may think that the different human like characters (Woody the cowboy for instance) aren&apos;t always as perfect as we are used to see in todays animated movies. Perhaps that&apos;s true, but if you keep in mind that all this was done in 1995, when computers weren&apos;t yet as strong and the technology for creating such movies was almost unknown, than you can only have a lot of respect for what the creators did. I loved the story and liked the animations a lot. I give it an 8.5/10.",https://www.imdb.com/title/tt0114709/,8.3,"['Tom Hanks', 'Tim Allen', 'Don Rickles']",['John Lasseter']
324,Avengers: Endgame (2019) - IMDb,https://m.media-amazon.com/images/M/MV5BMTc5MDE2ODcwNV5BMl5BanBnXkFtZTgwMzI2NzQ2NzM@._V1_.jpg,"After the devastating events of Avengers: Infinity War (2018), the universe is in ruins. With the help of remaining allies, the Avengers assemble once more in order to reverse Thanos&apos; actions and restore balance to the universe.",2019-05-08,3H1M,"After watching Infinity war, I was looking forward to much more this time, still a perfect ending.",https://www.imdb.com/title/tt4154796/,8.4,"['Robert Downey Jr.', 'Chris Evans', 'Mark Ruffalo']","['Anthony Russo', 'Joe Russo']"
325,Oldboy (2003) - IMDb,https://m.media-amazon.com/images/M/MV5BMTI3NTQyMzU5M15BMl5BanBnXkFtZTcwMTM2MjgyMQ@@._V1_.jpg,"After being kidnapped and imprisoned for fifteen years, Oh Dae-Su is released, only to find that he must track down his captor in five days.",2021-06-13,2H,When I search google for the most confusing movie this movie was on the list so I gave it a shot didn&apos;t expect it to be this good the way it shows the story line it was amazing and creative. Loved every bit of it. Kind of disturbing but for those who like adult kind of movie it surely a must watch.,https://www.imdb.com/title/tt0364569/,8.3,"['Choi Min-sik', 'Yoo Ji-tae', 'Kang Hye-jeong']",['Park Chan-wook']
326,Dr. Strangelove or: How I Learned to Stop Worrying and Love the Bomb (1964) - IMDb,https://m.media-amazon.com/images/M/MV5BMjFjYzBlOTktMTI2OS00ZWVhLTgxMDUtNzAwODY2NmI3YTAzXkEyXkFqcGc@._V1_.jpg,"A mentally unstable American general orders a hydrogen bomb attack on the Soviet Union, triggering a path to global nuclear holocaust that a war room full of politicians and generals frantically tries to stop.",2013-12-26,1H35M,"I never really bought into the Kubrick hype. I mean: don&apos;t get me wrong; I like all of his films very much - but to me, they all feel somewhat over-constructed and lack a natural flow. And then I finally got to see &apos;Dr.Strangelove&apos;. Wow. What a terrific, pitch black satire. This film is so wild and mean and funny - and Peter Sellers gives THE performance of his career. Unlike in any of Kubrick&apos;s later works, there&apos;s a sense of playfulness here that gives the whole movie a crazy kind of energy; I&apos;m guessing that Seller&apos;s love for improvisation forced Kubrick to ditch his usual perfectionism to a certain degree (and the film is all the better for it). Sharp, outrageously entertaining comedy/satire by one of the most revered directors of the past century. 10 out of 10.

Favorite films: http://www.IMDb.com/list/mkjOKvqlSBs/

Lesser-known Masterpieces: http://www.imdb.com/list/ls070242495/

Favorite Low-Budget and B-Movies: http://www.imdb.com/list/ls054808375/

Favorite TV-Shows reviewed: http://www.imdb.com/list/ls075552387/",https://www.imdb.com/title/tt0057012/,8.3,"['Peter Sellers', 'George C. Scott', 'Sterling Hayden']",['Stanley Kubrick']
327,Good Will Hunting (1997) - IMDb,https://m.media-amazon.com/images/M/MV5BNDdjZGQ5YzEtNTc2My00Mjc0LWFlMTctYzkwMzZlNzdiZWYzXkEyXkFqcGc@._V1_.jpg,"Will Hunting, a janitor at MIT, has a gift for mathematics, but needs help from a psychologist to find direction in his life.",2019-10-22,2H6M,Robin Williams gives the best performance of his career alongside memorable performances from Matt Damon and Ben Affleck. This masterpiece will have you laughing and crying and by the end feeling reborn.,https://www.imdb.com/title/tt0119217/,8.3,"['Robin Williams', 'Matt Damon', 'Ben Affleck']",['Gus Van Sant']
328,American Beauty (1999) - IMDb,https://m.media-amazon.com/images/M/MV5BMDI1MDE0OTMtMmI2MS00Yjc2LTg2MTItMWExYTg5NzA1OGUzXkEyXkFqcGc@._V1_.jpg,A sexually frustrated suburban father has a mid-life crisis after becoming infatuated with his daughter&apos;s best friend.,2000-03-22,2H2M,"I have come to see the movie with a certain prejudice.  Everyone saying that it was so wonderful, so touching, so excited -- I usually tend to go with movies that nobody likes.  Nevertheless, this one was a certain exception.

It is a wonderful psychological drama, a satire about the American community and about the American life; dark, painful irony and cynicism in the descriptions of life and characters; deep sarcasm on types of people in the community, habits of behaviour such as &quot;...if you want to succeed, you always have to seem successful...&quot; or &quot;never stop smiling&quot;, parasites of the community, and, most importantly, the treatment of people who are &quot;different&quot;, who are &quot;freaky&quot; to some extent; and eventually, there is no character in the film that is not odd in its way, although we have to wait for the very ending of the film, to discover this.

With very deep and accurate exaggeration, (most of) the characters in the movie demonstrate the worst, the darkest sides of their personality, while still remaining very human, very touching and very involving the observer. Everyone can find a certain similarity with characters and persons who he met in his life, in the characters described in the film.  The tragi-comical events, the little pieces of funny, disturbing irony dripping from almost every episode, lead the observer to exploration of the American Beauty -- the beauty in life, and the way that we fail to find it, for all our life; the way we hide our feelings and emotions, even behind sullen walls of our sepulchre.

The acting is truly brilliant, the episodes are built logically, coherently, the dialogues are deep, thrilling, intriguing; every sentence and every word is deeply constructed, containing profound irony and intelligent elements of humors.  The plot is very intelligently built, constructing a true indication of the sad situation of the American society, and an excellent ground for the actors.

An amazing movie, strongly recommended.  10/10",https://www.imdb.com/title/tt0169547/,8.3,"['Kevin Spacey', 'Annette Bening', 'Thora Birch']",['Sam Mendes']
